{
  "schema_version": "1.0.0",
  "record_type": "compatibility_observation",
  "observation_id": "obs_synthetic_001",
  "device_id": "usb:FFFF:0001",
  "host": {"manufacturer": "CompatForge Fixture Labs", "model": "Reference Host A", "architecture": "x86_64", "operating_system": {"family": "ubuntu", "version": "fixture-1"}},
  "connection_path": [{"kind": "direct_port"}],
  "driver": {"name": "fixture-driver", "version": "1.0"},
  "outcome": "works_with_conditions",
  "conditions": ["Synthetic condition used only to test the Phase 1 contract."],
  "evidence": {"source_type": "independent_reproduction", "source_url": "https://example.com/compatforge/synthetic-evidence", "source_title": "Synthetic CompatForge contract fixture"},
  "observed_at": "2026-09-07T00:00:00Z",
  "recorded_at": "2026-09-07T00:00:00Z",
  "limitations": ["This is synthetic data and must never be presented as a real hardware result."]
}
